{
  "case_id": "SWESMITH_036",
  "failure_pattern": "broke_existing_contract_or_behavior",
  "pattern_confidence": "HIGH",
  "failure_scope": "CODE_STATE",
  "taxonomy_fit": "DIRECT",
  "supporting_evidence_ids": ["BUG_DIFF", "CODE_CONTEXT_01", "TEST_FAILURE_01", "TEST_FAILURE_02"],
  "reasoning_summary": "BUG_DIFF makes _ignore_ an inferred enum member and removes the standard _name_ and _value_ properties from synthesized members; TEST_FAILURE_01 and TEST_FAILURE_02 directly confirm both enum behaviors regress.",
  "proposed_other_pattern": null
}
