{
  "case_id": "SWESMITH_043",
  "failure_pattern": "broke_existing_contract_or_behavior",
  "pattern_confidence": "MEDIUM",
  "failure_scope": "CODE_STATE",
  "taxonomy_fit": "DIRECT",
  "supporting_evidence_ids": ["BUG_DIFF", "CODE_CONTEXT_01", "TEST_FAILURE_01"],
  "reasoning_summary": "BUG_DIFF moves condition notification after external event signaling in close, changing the established ordering by which blocked readers are released; CODE_CONTEXT_01 documents immediate closed-pipe read semantics and TEST_FAILURE_01 confirms a downstream agent read regresses.",
  "proposed_other_pattern": null
}
