{
  "case_id": "SWESMITH_031",
  "failure_pattern": "false_premise_about_existing_code",
  "pattern_confidence": "HIGH",
  "failure_scope": "CODE_STATE",
  "taxonomy_fit": "DIRECT",
  "supporting_evidence_ids": ["BUG_DIFF", "CODE_CONTEXT_01", "TEST_FAILURE_01"],
  "reasoning_summary": "BUG_DIFF materializes parse results into an OrderedDict before interpolation, incorrectly collapsing repeated keys that resolve sequentially; CODE_CONTEXT_01 shows resolve_variables depends on that stream order, and TEST_FAILURE_01 covers the duplicate-key reference case.",
  "proposed_other_pattern": null
}
