{
  "case_id": "SWESMITH_005",
  "failure_pattern": "false_premise_about_existing_code",
  "pattern_confidence": "HIGH",
  "failure_scope": "CODE_STATE",
  "taxonomy_fit": "DIRECT",
  "supporting_evidence_ids": ["BUG_DIFF", "TEST_FAILURE_01", "TEST_FAILURE_02"],
  "reasoning_summary": "BUG_DIFF assumes sorting stringified outer items is equivalent to sorting the hashes within each item, and it also drops the prefix from the returned value; both established digest cases fail in TEST_FAILURE_01 and TEST_FAILURE_02.",
  "proposed_other_pattern": null
}
