{
  "case_id": "SWESMITH_096",
  "failure_pattern": "incomplete_change_propagation",
  "pattern_confidence": "HIGH",
  "failure_scope": "CODE_STATE",
  "taxonomy_fit": "DIRECT",
  "supporting_evidence_ids": ["BUG_DIFF", "CODE_CONTEXT_06", "TEST_FAILURE_01"],
  "reasoning_summary": "BUG_DIFF removes TypeVar from the typing imports while CODE_CONTEXT_06 still evaluates FILTER_TYPE = TypeVar(\"FILTER_TYPE\") and uses it in several helpers, leaving the typing rollback incomplete and causing the EC2 import path exercised by TEST_FAILURE_01 to fail.",
  "proposed_other_pattern": null
}
