{
  "case_id": "SWESMITH_035",
  "failure_pattern": "false_premise_about_existing_code",
  "pattern_confidence": "HIGH",
  "failure_scope": "CODE_STATE",
  "taxonomy_fit": "DIRECT",
  "supporting_evidence_ids": ["BUG_DIFF", "CODE_CONTEXT_01", "TEST_FAILURE_01"],
  "reasoning_summary": "BUG_DIFF assigns no multiplier to EPOCH_NANOSECOND and applies 10^9 to the default epoch unit, reversing the units represented by DATE_PART; CODE_CONTEXT_01 shows that scale feeds TimeToUnix multiplication and TEST_FAILURE_01 covers timestamp conversion.",
  "proposed_other_pattern": null
}
