{
  "case_id": "SWESMITH_070",
  "failure_pattern": "broke_existing_contract_or_behavior",
  "pattern_confidence": "HIGH",
  "failure_scope": "CODE_STATE",
  "taxonomy_fit": "DIRECT",
  "supporting_evidence_ids": ["BUG_DIFF", "CODE_CONTEXT_01", "TEST_FAILURE_03"],
  "reasoning_summary": "BUG_DIFF replaces the order-independent absolute time difference with `self.time - track_point.time`, allowing a negative result when the other point is later. CODE_CONTEXT_01 shows speed and missing-speed calculations consume this duration as an elapsed interval, and TEST_FAILURE_03 directly confirms the time-difference contract is broken.",
  "proposed_other_pattern": null
}
