{
  "case_id": "SWESMITH_062",
  "failure_pattern": "false_premise_about_existing_code",
  "pattern_confidence": "HIGH",
  "failure_scope": "CODE_STATE",
  "taxonomy_fit": "DIRECT",
  "supporting_evidence_ids": ["BUG_DIFF", "CODE_CONTEXT_01", "TEST_FAILURE_01"],
  "reasoning_summary": "BUG_DIFF changes three cursor offsets from minus one to minus zero; CODE_CONTEXT_01 consequently advances across the full multi-character delimiter and slices from the wrong current positions, so delimiter text is consumed or included incorrectly, as confirmed by TEST_FAILURE_01's Jinja tokenization failure.",
  "proposed_other_pattern": null
}
