{
  "case_id": "SWESMITH_095",
  "failure_pattern": "false_premise_about_existing_code",
  "pattern_confidence": "HIGH",
  "failure_scope": "CODE_STATE",
  "taxonomy_fit": "DIRECT",
  "supporting_evidence_ids": ["BUG_DIFF", "TEST_FAILURE_01", "TEST_FAILURE_03"],
  "reasoning_summary": "BUG_DIFF moves the assignment of rels_of_reltype below all of its uses and after an unconditional return, so part_with_reltype fails on an unbound local before it can implement any lookup behavior; TEST_FAILURE_01 and TEST_FAILURE_03 cover the affected method.",
  "proposed_other_pattern": null
}
