{
  "case_id": "SWESMITH_049",
  "failure_pattern": "false_premise_about_existing_code",
  "pattern_confidence": "HIGH",
  "failure_scope": "CODE_STATE",
  "taxonomy_fit": "DIRECT",
  "supporting_evidence_ids": ["BUG_DIFF", "CODE_CONTEXT_01", "TEST_FAILURE_02", "TEST_FAILURE_14"],
  "reasoning_summary": "BUG_DIFF removes ImportFrom's Import superclass even though CODE_CONTEXT_01 shows its methods require the inherited syntax-node state such as children and the parser-node initialization path; TEST_FAILURE_02 and TEST_FAILURE_14 confirm import parsing regressions.",
  "proposed_other_pattern": null
}
