{
  "case_id": "SWESMITH_079",
  "failure_pattern": "false_premise_about_existing_code",
  "pattern_confidence": "HIGH",
  "failure_scope": "CODE_STATE",
  "taxonomy_fit": "DIRECT",
  "supporting_evidence_ids": ["BUG_DIFF", "CODE_CONTEXT_01", "TEST_FAILURE_01", "TEST_FAILURE_03"],
  "reasoning_summary": "BUG_DIFF moves the _apply return ahead of the local var_func definition, incorrectly assuming that closure can be referenced before its assignment; CODE_CONTEXT_01 makes the resulting unbound local and unreachable variance setup explicit, and the cited var/std tests fail.",
  "proposed_other_pattern": null
}
