{
  "case_id": "SWESMITH_092",
  "failure_pattern": "false_premise_about_existing_code",
  "pattern_confidence": "HIGH",
  "failure_scope": "CODE_STATE",
  "taxonomy_fit": "DIRECT",
  "supporting_evidence_ids": ["BUG_DIFF", "CODE_CONTEXT_01", "TEST_FAILURE_01", "TEST_FAILURE_02"],
  "reasoning_summary": "BUG_DIFF rewrites dataclass serialization around role_map and class_map, which CODE_CONTEXT_01 shows belong to PDFStructTree rather than PDFStructElement, while omitting the element's actual type, text, page, attributes, and MCID fields; the cited conversion and tree tests fail on that false object model.",
  "proposed_other_pattern": null
}
