{
  "case_id": "SWESMITH_056",
  "failure_pattern": "wrong_baseline_or_branch",
  "pattern_confidence": "HIGH",
  "failure_scope": "CODE_STATE",
  "taxonomy_fit": "DIRECT",
  "supporting_evidence_ids": ["BUG_DIFF", "CODE_CONTEXT_01", "TEST_FAILURE_01"],
  "reasoning_summary": "BUG_DIFF reintroduces Bokeh's older plot_height figure attribute, removes the Bokeh-3 compatibility warnings, and stops filtering the non-figure label_size option; CODE_CONTEXT_01 is therefore aligned to an obsolete Bokeh API baseline, and TEST_FAILURE_01 confirms multi-plot failure.",
  "proposed_other_pattern": null
}
