{
  "case_id": "SWESMITH_051",
  "failure_pattern": "false_premise_about_existing_code",
  "pattern_confidence": "HIGH",
  "failure_scope": "CODE_STATE",
  "taxonomy_fit": "DIRECT",
  "supporting_evidence_ids": ["BUG_DIFF", "CODE_CONTEXT_01", "TEST_FAILURE_01", "TEST_FAILURE_02"],
  "reasoning_summary": "BUG_DIFF changes the matched shortcode slice from i:j+1 to i:j-1; because Python excludes the upper bound, CODE_CONTEXT_01 now drops the closing token and the token immediately before it, while TEST_FAILURE_01 and TEST_FAILURE_02 confirm downstream rendering failures.",
  "proposed_other_pattern": null
}
