{
  "case_id": "SWESMITH_086",
  "failure_pattern": "false_premise_about_existing_code",
  "pattern_confidence": "HIGH",
  "failure_scope": "CODE_STATE",
  "taxonomy_fit": "DIRECT",
  "supporting_evidence_ids": ["BUG_DIFF", "CODE_CONTEXT_01", "TEST_FAILURE_01"],
  "reasoning_summary": "BUG_DIFF rewrites dispatch around FileType.VIRTUAL_ENV, REQUIREMENTS, and PYTHON and a different reader, but the repository contract uses VIRTUAL_ENVIRONMENT plus the four concrete lock/manifest types; this false enum/API model breaks the CLI path exercised by TEST_FAILURE_01.",
  "proposed_other_pattern": null
}
