{
  "case_id": "SWESMITH_100",
  "failure_pattern": "broke_existing_contract_or_behavior",
  "pattern_confidence": "HIGH",
  "failure_scope": "CODE_STATE",
  "taxonomy_fit": "DIRECT",
  "supporting_evidence_ids": ["BUG_DIFF", "CODE_CONTEXT_01", "TEST_FAILURE_01", "TEST_FAILURE_02"],
  "reasoning_summary": "BUG_DIFF stops find_dotenv from skipping frames whose co_filename does not exist on the filesystem, so CODE_CONTEXT_01 can pass a zip-import pseudo-path to _walk_to_root and break both graceful zip-import behaviors covered by TEST_FAILURE_01 and TEST_FAILURE_02.",
  "proposed_other_pattern": null
}
